{
  "schema": "ev4-responsive-rolling-queue@1.0.0",
  "queue_id": "EV4RQ-0001-SMART-HOME",
  "project": "EV4 Responsive Architect",
  "queue_status": "active",
  "controller_policy": {
    "one_task_per_run": true,
    "critique_same_task": true,
    "small_in_scope_fixes_allowed": true,
    "ci_required_for_repo_changes": true,
    "minimum_pending_tasks": 4,
    "refresh_every_nth_task": 5,
    "real_pilot_requires_submitted_packet_and_readiness_pass": true
  },
  "active_cycle": {
    "cycle_id": "CYCLE-001",
    "cycle_status": "active",
    "started_from_status": "p0_semantic_gates_merged_but_status_and_issue_pending_sync",
    "goal": "Prepare the repository for real smart-home evidence execution while preserving sample-vs-real and production-claim boundaries.",
    "task_order": ["RQ-0001", "RQ-0002", "RQ-0003", "RQ-0004", "RQ-0005", "RQ-0006", "RQ-0007", "RQ-0008", "RQ-0009", "RQ-0010", "RQ-0011", "RQ-0012", "RQ-0013", "RQ-0014", "RQ-0015", "RQ-0016"]
  },
  "tasks": [
    {"task_id":"RQ-0001","cycle_position":1,"task_type":"repo_sync","status":"completed","title":"Sync STATUS and Issue 8","objective":"Update STATUS.md and Issue #8 to reflect P0 semantic gate completion, current schema versions, and real evidence requirements.","allowed_work":["Update STATUS.md and Issue #8 synchronization artifacts."],"forbidden_work":["Do not claim real evidence has been submitted.","Do not start the real pilot."],"requires_real_evidence":false,"expected_artifacts":["STATUS.md","Issue #8 comment"],"acceptance_criteria":["STATUS and Issue #8 reflect evidence requirements."],"critique_required":true,"dependencies":[],"completion":{"run_id":"automation-run-001","status":"completed","artifacts":["STATUS.md","Issue #8 comment 4780297476"],"critique_findings":["Status/issue sync had to preserve the no-real-evidence boundary."],"boundary":"No real evidence was claimed, no real pilot was started, and Issue #8 remains open."}},
    {"task_id":"RQ-0002","cycle_position":2,"task_type":"evidence_bridge","status":"completed","title":"Define Issue-to-Packet bridge","objective":"Create a bounded mapper specification for converting Issue #8 evidence into EVIDENCE_INTAKE_PACKET.submitted.json without silently inventing missing evidence.","allowed_work":["Add bridge contract and validation fixtures."],"forbidden_work":["Do not scrape or infer absent evidence.","Do not auto-generate a submitted packet from incomplete Issue text."],"requires_real_evidence":false,"expected_artifacts":["docs/15_ISSUE_TO_PACKET_BRIDGE.md","bridge schema","fixtures"],"acceptance_criteria":["Unsafe text-only visual proof remains blocked."],"critique_required":true,"dependencies":["RQ-0001"],"completion":{"run_id":"automation-run-002","status":"completed","artifacts":["docs/15_ISSUE_TO_PACKET_BRIDGE.md","schemas/ev4-responsive-issue-to-packet-bridge.schema.json","validation/fixtures/valid/issue_to_packet_bridge.valid.json","validation/fixtures/invalid/issue_to_packet_bridge.text_as_visual_proof.invalid.json"],"critique_findings":["The bridge must not make Issue #8 text equivalent to screenshot, export, DOM, CSS, accessibility, or live-render evidence."],"boundary":"No submitted packet was generated, no real evidence was claimed, and the real pilot remains blocked."}},
    {"task_id":"RQ-0003","cycle_position":3,"task_type":"validator_hardening","status":"completed","title":"Add conflict summary to readiness path","objective":"Add an evidence_conflict_summary requirement to readiness artifacts so unresolved conflicts remain visible and blocked downstream.","allowed_work":["Extend readiness/conflict artifacts or docs with conflict summary fields."],"forbidden_work":["Do not resolve conflicts without rationale.","Do not loosen readiness gates."],"requires_real_evidence":false,"expected_artifacts":["readiness schema","readiness validator","fixtures","STATUS.md"],"acceptance_criteria":["Unresolved blocking conflict cannot produce ready readiness."],"critique_required":true,"dependencies":["RQ-0002"],"completion":{"run_id":"automation-run-003","status":"completed","artifacts":["schemas/ev4-responsive-pilot-readiness.schema.json","validation/e2e/run_pilot_readiness_check.py","validation/fixtures/valid/pilot_readiness.partial.valid.json","validation/fixtures/invalid/pilot_readiness.hidden_unresolved_conflict.invalid.json","docs/10_PILOT_READINESS_GATE.md","STATUS.md"],"critique_findings":["Readiness previously exposed visible flags but needed durable conflict summary carry-forward."],"boundary":"No conflict was resolved without rationale, no pilot was started, and no real evidence was claimed."}},
    {"task_id":"RQ-0004","cycle_position":4,"task_type":"pilot_preparation","status":"completed","title":"Prepare real pilot artifact slots","objective":"Create template-only placeholder paths for real submitted artifacts without pretending real evidence exists.","allowed_work":["Add template manifest and submitted-mode command documentation."],"forbidden_work":["Do not commit runtime .generated.json outputs.","Do not fabricate screenshots, hashes, or Elementor export data."],"requires_real_evidence":false,"expected_artifacts":["docs/17_REAL_PILOT_ARTIFACT_SLOTS.md","templates/real-pilot/REAL_PILOT_ARTIFACT_SLOTS.template.json","STATUS.md"],"acceptance_criteria":["Templates cannot pass as real submitted evidence."],"critique_required":true,"dependencies":["RQ-0003"],"completion":{"run_id":"automation-run-004","status":"completed","artifacts":["docs/17_REAL_PILOT_ARTIFACT_SLOTS.md","templates/real-pilot/REAL_PILOT_ARTIFACT_SLOTS.template.json","STATUS.md"],"critique_findings":["Submitted-mode commands were documented as expected command shape only; templates remain non-evidence."],"boundary":"Template-only; no generated submitted outputs; no real pilot authorization."}},
    {"task_id":"RQ-0005","cycle_position":5,"task_type":"queue_refresh","status":"completed","title":"Refresh rolling queue","objective":"Audit RQ-0001 through RQ-0004 and write the next bounded tasks.","allowed_work":["Review completed work and replenish bounded queue."],"forbidden_work":["Do not schedule real pilot execution unless real evidence and readiness pass."],"requires_real_evidence":false,"expected_artifacts":["planning/EV4_ROLLING_QUEUE.json","STATUS.md"],"acceptance_criteria":["Every fifth task remains queue_refresh and blockers are preserved."],"critique_required":true,"dependencies":["RQ-0001","RQ-0002","RQ-0003","RQ-0004"],"completion":{"run_id":"automation-run-005","status":"completed","artifacts":["planning/EV4_ROLLING_QUEUE.json","STATUS.md"],"critique_findings":["Refresh preserved completed history and did not fold schema compatibility into unrelated work."],"boundary":"No real pilot was scheduled, no real evidence was claimed, and release-boundary prohibitions remain in force."}},
    {"task_id":"RQ-0006","cycle_position":6,"task_type":"validator_hardening","status":"completed","title":"Add bridge semantic validation runner","objective":"Add a dedicated E2E check for the issue-to-packet bridge so unsafe mappings fail outside generic schema validation.","allowed_work":["Create bridge semantic validator and workflow step."],"forbidden_work":["Do not generate a submitted packet.","Do not mark Issue #8 evidence as complete."],"requires_real_evidence":false,"expected_artifacts":["validation/e2e/run_issue_to_packet_bridge_check.py",".github/workflows/validate.yml","planning/EV4_ROLLING_QUEUE.json","STATUS.md"],"acceptance_criteria":["Dedicated validator rejects unsafe mappings."],"critique_required":true,"dependencies":["RQ-0005"],"completion":{"run_id":"automation-run-006","status":"completed","artifacts":["validation/e2e/run_issue_to_packet_bridge_check.py",".github/workflows/validate.yml","planning/EV4_ROLLING_QUEUE.json","STATUS.md"],"critique_findings":["The bridge semantic check must assert pilot blocking without treating Issue #8 as complete."],"boundary":"No submitted packet was generated, no real evidence was claimed, Issue #8 remains evidence-pending, and the real pilot remains blocked."}},
    {"task_id":"RQ-0007","cycle_position":7,"task_type":"validator_hardening","status":"completed","title":"Add conflict-summary generated-report check","objective":"Add a focused check proving blocker_conflicts become blocked_conflicting_evidence and carry conflict records forward.","allowed_work":["Add conflict fixture and readiness assertions."],"forbidden_work":["Do not authorize pilot execution.","Do not treat sample conflict fixtures as real evidence."],"requires_real_evidence":false,"expected_artifacts":["validation/fixtures/valid/evidence_intake_packet.conflict.valid.json","validation/e2e/run_pilot_readiness_check.py","planning/EV4_ROLLING_QUEUE.json","STATUS.md"],"acceptance_criteria":["Generated readiness from conflict input blocks pilot start."],"critique_required":true,"dependencies":["RQ-0005"],"completion":{"run_id":"automation-run-007","status":"completed","artifacts":["validation/fixtures/valid/evidence_intake_packet.conflict.valid.json","validation/e2e/run_pilot_readiness_check.py","planning/EV4_ROLLING_QUEUE.json","STATUS.md"],"critique_findings":["The self-test needed to explicitly lock the blocker_conflicts generated-report path."],"boundary":"No pilot was authorized, no sample fixture was treated as real evidence, and missing-evidence/privacy blockers were not weakened."}},